{
 "format": "spyder-bone/engine_check",
 "format_version": 1,
 "check": "evidence_levels",
 "id": "check.evidence_levels",
 "version": "1.0.1",
 "engine_min": "1.1",
 "status": "active",
 "title": "Organic-evidence level (none / trace / clear / strong / can't tell) and score S",
 "description": "Normative rule of the frozen evidence study (PLAN v3.2 Step 7). E = -1e5 x SG31 cubic 2nd derivative of log10(1/max(R,1e-6)); band reading = mean E over centre +- half width; u_b = E_b / w_b (band centres, weights, faint thresholds and noise windows from bands.json). Band state: can't tell if sd_u > sd_max_u and u < unreadable_only_if_u_below; else strong (u >= strong), clear (u >= clear), faint (u > faint_b), flat. Lit = faint, clear or strong. S = median u over readable core bands (null if none readable). none: every core band flat or unreadable, the must-be-readable bands readable, >= min_readable_core readable, the extra band <= extra_band_max_u or unreadable (sd only), guard max E < max_E_below. can't tell: not none, no core band lit, guard passes, extra band not resolved-and-readable. strong: S >= strong, every readable core band lit, an N-H type band >= nh_type_min_u. clear: S >= clear, >= clear_min_lit_core lit, an N-H type band >= nh_type_min_u. trace: otherwise. Never a %. A band with a 'projection' in bands.json (NH1545c: the OH-corrected 1545 nm trough) is read on the projected window and u = u_sign x E / w.",
 "licence": "CC-BY-4.0",
 "created": "2026-10-03",
 "provenance": {
  "basis": "Frozen 2026-10-02 (Phase 0a A3; rule script hash 355dd063...). Weights = median band ratios over the 140 Ryder et al. 2026 reference bones >= 1% (public mmc2). Faint thresholds = 99th percentile of collagen-free archaeological fauna (unreleased data; statistics only, no site named). Guard set on bison bone (Ryder et al. 2026b, Archaeometry SI). Validation per spectrum: 0 of 72 spectra >= 3% yield called 'none' (one-sided 95% bound 4.1%).",
  "nh1545c": "Phase 0c (DECISIONS 75): the OH-corrected 1545 nm trough is a 5th core band (in S and in lit / flat, never an N-H-type band), lit line 1.5 u set on true-zero archaeological bone (no scan of the collagen-free reference layers exceeds 1.5 u). Across 3,280 scans it changes one verdict (a false evidence lift on an unflagged alkyd-coated scan) and no 'none' call on true-zero bone; the stress test (none at >= 3% / >= 1%) is unchanged."
 },
 "parameters": {
  "kernel": {
   "absorbance_clip": 1e-06,
   "savgol": {
    "window": 31,
    "polyorder": 3,
    "deriv": 2,
    "delta": 1.0,
    "mode": "interp"
   },
   "scale": -100000.0
  },
  "core_bands": [
   "CH1728",
   "CH1689",
   "CH2262",
   "AM2175",
   "NH1545c"
  ],
  "extra_band": "NH2044",
  "extra_band_faint_u": 0.0,
  "readability": {
   "sd_max_u": 0.25,
   "unreadable_only_if_u_below": 1.5
  },
  "thresholds_u": {
   "clear": 1.5,
   "strong": 4.0
  },
  "guard": {
   "window_nm": [
    1675,
    1770
   ],
   "max_E_below": 1.5
  },
  "none_rule": {
   "must_be_readable": [
    "CH1728",
    "AM2175"
   ],
   "min_readable_core": 3,
   "extra_band_max_u": 0.0
  },
  "nh_type_bands": [
   "AM2175",
   "NH2044"
  ],
  "nh_type_min_u": 1.5,
  "clear_min_lit_core": 3,
  "levels": [
   "none",
   "can't tell",
   "strong",
   "clear",
   "trace"
  ]
 },
 "golden": {
  "spectra_file": "golden_spectra_checks_v1.json",
  "tolerance": {
   "abs": 1e-09,
   "rel": 1e-09
  },
  "cases": [
   {
    "name": "rc_flat_none_low_m",
    "spectrum_sha256": "ef8ddf9e2c7d95bc6ca3d426aca0859ecb56e566fc930cb047d336251ebf75ea",
    "inputs": {
     "sd_E": {
      "AM2175": 0.03420179724611824,
      "CH1689": 0.019345530481705505,
      "CH1728": 0.021890995018772015,
      "CH2262": 0.033226508141217935,
      "CH2284": 0.04032618936797391,
      "NH1545c": 0.012727322685332568,
      "NH2044": 0.03420179724611824
     }
    },
    "expected": {
     "status": "assessed",
     "level": "none",
     "S": -0.37415380690967764,
     "n_readable_core": 5,
     "n_lit_core": 0,
     "guard_max_E": 1.0249117368665177,
     "bands.CH1728.E": -0.36117454540948507,
     "bands.CH1728.u": -0.36117454540948507,
     "bands.CH1728.sd_u": 0.021890995018772015,
     "bands.CH1728.state": "flat",
     "bands.CH1689.E": -0.318030735873226,
     "bands.CH1689.u": -0.37415380690967764,
     "bands.CH1689.sd_u": 0.02275944762553589,
     "bands.CH1689.state": "flat",
     "bands.CH2262.E": -0.7967160577950156,
     "bands.CH2262.u": -0.49794753612188475,
     "bands.CH2262.sd_u": 0.020766567588261207,
     "bands.CH2262.state": "flat",
     "bands.AM2175.E": -0.759554649876217,
     "bands.AM2175.u": -0.6905042271601972,
     "bands.AM2175.sd_u": 0.031092542951016582,
     "bands.AM2175.state": "flat",
     "bands.NH1545c.E": -0.573485655594834,
     "bands.NH1545c.u": 0.9558094259913901,
     "bands.NH1545c.sd_u": 0.021212204475554282,
     "bands.NH1545c.state": "flat",
     "bands.NH2044.E": -1.6463560447242114,
     "bands.NH2044.u": -1.028972527952632,
     "bands.NH2044.sd_u": 0.021376123278823902,
     "bands.NH2044.state": "flat"
    }
   },
   {
    "name": "rc_good_positive_all_six",
    "spectrum_sha256": "ea4c88b7008cb8b19f102f52d39d19a2c4a0b1a93cda1f2e30545ecbdd6f407d",
    "inputs": {
     "sd_E": {
      "AM2175": 0.17510456752325637,
      "CH1689": 0.07426962965724354,
      "CH1728": 0.08404194934898611,
      "CH2262": 0.22942902282404629,
      "CH2284": 0.27845231829926986,
      "NH1545c": 0.04886159845871286,
      "NH2044": 0.17510456752325637
     }
    },
    "expected": {
     "status": "assessed",
     "level": "strong",
     "S": 8.102166238285102,
     "n_readable_core": 5,
     "n_lit_core": 5,
     "guard_max_E": 7.940387831911451,
     "bands.CH1728.E": 7.775438032989515,
     "bands.CH1728.u": 7.775438032989515,
     "bands.CH1728.sd_u": 0.08404194934898611,
     "bands.CH1728.state": "strong",
     "bands.CH1689.E": 6.947031646489213,
     "bands.CH1689.u": 8.17297840763437,
     "bands.CH1689.sd_u": 0.08737603489087475,
     "bands.CH1689.state": "strong",
     "bands.CH2262.E": 12.963465981256164,
     "bands.CH2262.u": 8.102166238285102,
     "bands.CH2262.sd_u": 0.14339313926502892,
     "bands.CH2262.state": "strong",
     "bands.AM2175.E": 10.441046382642527,
     "bands.AM2175.u": 9.491860347856843,
     "bands.AM2175.sd_u": 0.1591859704756876,
     "bands.AM2175.state": "strong",
     "bands.NH1545c.E": -4.651582575859624,
     "bands.NH1545c.u": 7.7526376264327075,
     "bands.NH1545c.sd_u": 0.0814359974311881,
     "bands.NH1545c.state": "strong",
     "bands.NH2044.E": 16.07168393065053,
     "bands.NH2044.u": 10.04480245665658,
     "bands.NH2044.sd_u": 0.10944035470203523,
     "bands.NH2044.state": "strong"
    }
   },
   {
    "name": "rc_borderline_1p2_positive_all_six",
    "spectrum_sha256": "fe3e8c7c72ce41350ae8886815487e910ad88cc9cb7e013a6caeb3970661f3c8",
    "inputs": {
     "sd_E": {
      "AM2175": 0.06743720902621549,
      "CH1689": 0.03560131317418754,
      "CH1728": 0.04028569648658063,
      "CH2262": 0.1382123983436329,
      "CH2284": 0.1677449620922724,
      "NH1545c": 0.023421916561965486,
      "NH2044": 0.06743720902621549
     }
    },
    "expected": {
     "status": "assessed",
     "level": "clear",
     "S": 2.0997920638013965,
     "n_readable_core": 5,
     "n_lit_core": 5,
     "guard_max_E": 2.062163335484781,
     "bands.CH1728.E": 2.033612812404246,
     "bands.CH1728.u": 2.033612812404246,
     "bands.CH1728.sd_u": 0.04028569648658063,
     "bands.CH1728.state": "clear",
     "bands.CH1689.E": 1.7955005174943495,
     "bands.CH1689.u": 2.1123535499933523,
     "bands.CH1689.sd_u": 0.04188389785198535,
     "bands.CH1689.state": "clear",
     "bands.CH2262.E": 2.978002745914264,
     "bands.CH2262.u": 1.861251716196415,
     "bands.CH2262.sd_u": 0.08638274896477055,
     "bands.CH2262.state": "clear",
     "bands.AM2175.E": 2.3097712701815363,
     "bands.AM2175.u": 2.0997920638013965,
     "bands.AM2175.sd_u": 0.06130655366019589,
     "bands.AM2175.state": "clear",
     "bands.NH1545c.E": -1.4493512155803678,
     "bands.NH1545c.u": 2.4155853593006134,
     "bands.NH1545c.sd_u": 0.03903652760327581,
     "bands.NH1545c.state": "clear",
     "bands.NH2044.E": 2.3155408962850226,
     "bands.NH2044.u": 1.447213060178139,
     "bands.NH2044.sd_u": 0.04214825564138468,
     "bands.NH2044.state": "faint"
    }
   },
   {
    "name": "rc_plus_d",
    "spectrum_sha256": "0d746f7d2523970323c9a784eb4702ee9ca2089fe8d30d09d44e137bb2e2a9b7",
    "inputs": {
     "sd_E": {
      "AM2175": 0.1467232509033498,
      "CH1689": 0.1441364018497692,
      "CH1728": 0.16310171788263356,
      "CH2262": 0.222499102624217,
      "CH2284": 0.2700416459199899,
      "NH1545c": 0.09482658016432184,
      "NH2044": 0.1467232509033498
     }
    },
    "expected": {
     "status": "assessed",
     "level": "trace",
     "S": 4.56176871350317,
     "n_readable_core": 5,
     "n_lit_core": 3,
     "guard_max_E": 5.583435059315102,
     "bands.CH1728.E": 5.45821185529002,
     "bands.CH1728.u": 5.45821185529002,
     "bands.CH1728.sd_u": 0.16310171788263356,
     "bands.CH1728.state": "strong",
     "bands.CH1689.E": 4.9884095641985295,
     "bands.CH1689.u": 5.868717134351211,
     "bands.CH1689.sd_u": 0.16957223747031672,
     "bands.CH1689.state": "strong",
     "bands.CH2262.E": 7.298829941605073,
     "bands.CH2262.u": 4.56176871350317,
     "bands.CH2262.sd_u": 0.13906193914013562,
     "bands.CH2262.state": "strong",
     "bands.AM2175.E": -0.4999999999998842,
     "bands.AM2175.u": -0.4545454545453492,
     "bands.AM2175.sd_u": 0.1333847735484998,
     "bands.AM2175.state": "flat",
     "bands.NH1545c.E": -1.0800249583553522e-13,